{
  "$schema": "http://json-schema.org/draft-07/schema#",
  "title": "AtomEngine environment preset (M49)",
  "description": "Weather or time of day: Assets/Environments/<name>.json. The same keys as a level's lighting environment, all optional; what a preset leaves out comes from the level. Tune live in the developer tools (F10, Environment) and paste Copy as JSON here.",
  "type": "object",
  "additionalProperties": false,
  "properties": {
    "$schema": { "type": "string" },
    "name": { "type": "string", "description": "For people; the file name is what levels use." },
    "sunDirection": { "$ref": "#/definitions/vec3", "description": "Towards the sun (or the moon)." },
    "sunColor": { "$ref": "#/definitions/vec3" },
    "skyColor": { "$ref": "#/definitions/vec3", "description": "Ambient light from above." },
    "groundColor": { "$ref": "#/definitions/vec3", "description": "Ambient light bounced from below." },
    "fogColor": { "$ref": "#/definitions/vec3" },
    "fogDensity": { "type": "number", "minimum": 0, "description": "Used while the player's fog setting is \"level\"." },
    "skyGradient": {
      "type": "object",
      "additionalProperties": false,
      "properties": {
        "zenith": { "$ref": "#/definitions/vec3" },
        "horizon": { "$ref": "#/definitions/vec3" },
        "sunSize": { "type": "number", "minimum": 0, "maximum": 20 },
        "sunGlow": { "type": "number", "minimum": 0 }
      }
    },
    "water": {
      "type": "object",
      "additionalProperties": false,
      "properties": {
        "shallow": { "$ref": "#/definitions/vec3" },
        "deep": { "$ref": "#/definitions/vec3" },
        "skyReflection": { "type": "number", "minimum": 0, "maximum": 1 },
        "ripple": { "type": "number", "minimum": 0 },
        "glint": { "type": "number", "minimum": 0, "default": 1.0, "description": "The sun's highlight on the water." }
      }
    }
  },
  "definitions": {
    "vec3": { "type": "array", "items": { "type": "number" }, "minItems": 3, "maxItems": 3 }
  }
}
