{
  "$schema": "../Schemas/environment.schema.json",
  "name": "fog",
  "sunColor": [0.35, 0.35, 0.34],
  "skyColor": [0.7, 0.71, 0.72],
  "groundColor": [0.3, 0.3, 0.28],
  "fogDensity": 0.06,
  "skyGradient": {
    "zenith": [0.62, 0.64, 0.66],
    "horizon": [0.72, 0.73, 0.74],
    "sunSize": 1.6,
    "sunGlow": 0.2
  },
  "water": {
    "shallow": [0.3, 0.38, 0.36],
    "deep": [0.14, 0.2, 0.22],
    "skyReflection": 0.8,
    "ripple": 0.4,
    "glint": 0.3
  }
}
